{
  "version": 1,
  "id": "rook",
  "display_name": "Rook",
  "archetype": "motion-input close-range pressure",
  "health": 1000,
  "stun_limit": 1000,
  "physics": {
    "walk_forward": 3000,
    "walk_back": 2100,
    "dash_forward_ticks": 16,
    "dash_forward_distance": 96000,
    "dash_back_ticks": 20,
    "dash_back_distance": 85000,
    "jump_start_ticks": 4,
    "jump_velocity": 13500,
    "super_jump_velocity": 15500,
    "jump_horizontal": 4000,
    "gravity": 900,
    "proximity_threshold": 54000,
    "kara_throw_move_id": "command_fhp"
  },
  "pushbox": {
    "x": -16000,
    "y": 0,
    "width": 32000,
    "height": 90000
  },
  "hurtboxes": {
    "standing": [
      {
        "x": -15000,
        "y": 0,
        "width": 30000,
        "height": 95000
      }
    ],
    "crouching": [
      {
        "x": -17000,
        "y": 0,
        "width": 34000,
        "height": 55000
      }
    ],
    "air": [
      {
        "x": -14000,
        "y": 0,
        "width": 28000,
        "height": 85000
      }
    ]
  },
  "super_arts": [
    {
      "id": "art_1",
      "name": "Circuit Break",
      "move_id": "super_1",
      "credit_cost": 900,
      "selected_at": "match_setup",
      "role": "advancing_confirm"
    },
    {
      "id": "art_2",
      "name": "Forge Impact",
      "move_id": "super_2",
      "credit_cost": 1200,
      "selected_at": "match_setup",
      "role": "vertical_reversal"
    },
    {
      "id": "art_3",
      "name": "Rush Cascade",
      "move_id": "super_3",
      "credit_cost": 1500,
      "selected_at": "match_setup",
      "role": "long_reach_rush"
    }
  ],
  "default_super": "art_1",
  "target_combos": [
    {
      "from": "s_lp",
      "to": "s_mp",
      "requires_contact": true,
      "start": 3,
      "end": 8
    }
  ],
  "moves": [
    {
      "id": "s_lp",
      "name": "S LP",
      "kind": "normal",
      "command": "S+LP",
      "startup": 3,
      "active": 2,
      "recovery": 7,
      "hitboxes": [
        {
          "id": "h0",
          "start": 3,
          "end": 5,
          "x": 8000,
          "y": 54000,
          "width": 29000,
          "height": 17000,
          "level": "mid",
          "damage": 35,
          "stun": 45,
          "rank": 1,
          "hitstun": 14,
          "blockstun": 9,
          "push_x": 12000,
          "launch_y": 0,
          "knockdown": "none",
          "hit_group": 0,
          "juggle_cost": 1,
          "parryable": true
        }
      ],
      "events": [],
      "cancel_rules": [
        {
          "start": 3,
          "end": 8,
          "requires_contact": true,
          "targets": [
            "special",
            "selected_super",
            "ex_special"
          ]
        }
      ],
      "negative_edge": false,
      "availability": "base",
      "pose": "s_lp",
      "invulnerability": [],
      "movement": [],
      "projectile": null,
      "credit_cost": 0,
      "debit_on_start": false
    },
    {
      "id": "s_mp",
      "name": "S MP",
      "kind": "normal",
      "command": "S+MP",
      "startup": 5,
      "active": 3,
      "recovery": 12,
      "hitboxes": [
        {
          "id": "h0",
          "start": 5,
          "end": 8,
          "x": 8000,
          "y": 54000,
          "width": 43000,
          "height": 17000,
          "level": "mid",
          "damage": 65,
          "stun": 85,
          "rank": 2,
          "hitstun": 21,
          "blockstun": 13,
          "push_x": 12000,
          "launch_y": 0,
          "knockdown": "none",
          "hit_group": 0,
          "juggle_cost": 1,
          "parryable": true
        }
      ],
      "events": [],
      "cancel_rules": [
        {
          "start": 5,
          "end": 11,
          "requires_contact": true,
          "targets": [
            "special",
            "selected_super",
            "ex_special"
          ]
        }
      ],
      "negative_edge": false,
      "availability": "base",
      "pose": "s_mp",
      "invulnerability": [],
      "movement": [],
      "projectile": null,
      "credit_cost": 0,
      "debit_on_start": false
    },
    {
      "id": "s_hp",
      "name": "S HP",
      "kind": "normal",
      "command": "S+HP",
      "startup": 8,
      "active": 4,
      "recovery": 19,
      "hitboxes": [
        {
          "id": "h0",
          "start": 8,
          "end": 12,
          "x": 8000,
          "y": 54000,
          "width": 60000,
          "height": 17000,
          "level": "mid",
          "damage": 95,
          "stun": 125,
          "rank": 3,
          "hitstun": 26,
          "blockstun": 16,
          "push_x": 12000,
          "launch_y": 0,
          "knockdown": "none",
          "hit_group": 0,
          "juggle_cost": 1,
          "parryable": true
        }
      ],
      "events": [],
      "cancel_rules": [],
      "negative_edge": false,
      "availability": "base",
      "pose": "s_hp",
      "invulnerability": [],
      "movement": [],
      "projectile": null,
      "credit_cost": 0,
      "debit_on_start": false
    },
    {
      "id": "s_lk",
      "name": "S LK",
      "kind": "normal",
      "command": "S+LK",
      "startup": 3,
      "active": 2,
      "recovery": 7,
      "hitboxes": [
        {
          "id": "h0",
          "start": 3,
          "end": 5,
          "x": 8000,
          "y": 54000,
          "width": 36000,
          "height": 17000,
          "level": "mid",
          "damage": 35,
          "stun": 45,
          "rank": 1,
          "hitstun": 14,
          "blockstun": 9,
          "push_x": 12000,
          "launch_y": 0,
          "knockdown": "none",
          "hit_group": 0,
          "juggle_cost": 1,
          "parryable": true
        }
      ],
      "events": [],
      "cancel_rules": [
        {
          "start": 3,
          "end": 8,
          "requires_contact": true,
          "targets": [
            "special",
            "selected_super",
            "ex_special"
          ]
        }
      ],
      "negative_edge": false,
      "availability": "base",
      "pose": "s_lk",
      "invulnerability": [],
      "movement": [],
      "projectile": null,
      "credit_cost": 0,
      "debit_on_start": false
    },
    {
      "id": "s_mk",
      "name": "S MK",
      "kind": "normal",
      "command": "S+MK",
      "startup": 5,
      "active": 3,
      "recovery": 12,
      "hitboxes": [
        {
          "id": "h0",
          "start": 5,
          "end": 8,
          "x": 8000,
          "y": 54000,
          "width": 50000,
          "height": 17000,
          "level": "mid",
          "damage": 65,
          "stun": 85,
          "rank": 2,
          "hitstun": 21,
          "blockstun": 13,
          "push_x": 12000,
          "launch_y": 0,
          "knockdown": "none",
          "hit_group": 0,
          "juggle_cost": 1,
          "parryable": true
        }
      ],
      "events": [],
      "cancel_rules": [
        {
          "start": 5,
          "end": 11,
          "requires_contact": true,
          "targets": [
            "special",
            "selected_super",
            "ex_special"
          ]
        }
      ],
      "negative_edge": false,
      "availability": "base",
      "pose": "s_mk",
      "invulnerability": [],
      "movement": [],
      "projectile": null,
      "credit_cost": 0,
      "debit_on_start": false
    },
    {
      "id": "s_hk",
      "name": "S HK",
      "kind": "normal",
      "command": "S+HK",
      "startup": 8,
      "active": 4,
      "recovery": 19,
      "hitboxes": [
        {
          "id": "h0",
          "start": 8,
          "end": 12,
          "x": 8000,
          "y": 54000,
          "width": 67000,
          "height": 17000,
          "level": "mid",
          "damage": 95,
          "stun": 125,
          "rank": 3,
          "hitstun": 26,
          "blockstun": 16,
          "push_x": 12000,
          "launch_y": 0,
          "knockdown": "none",
          "hit_group": 0,
          "juggle_cost": 1,
          "parryable": true
        }
      ],
      "events": [],
      "cancel_rules": [],
      "negative_edge": false,
      "availability": "base",
      "pose": "s_hk",
      "invulnerability": [],
      "movement": [],
      "projectile": null,
      "credit_cost": 0,
      "debit_on_start": false
    },
    {
      "id": "c_lp",
      "name": "C LP",
      "kind": "normal",
      "command": "C+LP",
      "startup": 3,
      "active": 2,
      "recovery": 7,
      "hitboxes": [
        {
          "id": "h0",
          "start": 3,
          "end": 5,
          "x": 8000,
          "y": 20000,
          "width": 29000,
          "height": 17000,
          "level": "mid",
          "damage": 35,
          "stun": 45,
          "rank": 1,
          "hitstun": 14,
          "blockstun": 9,
          "push_x": 12000,
          "launch_y": 0,
          "knockdown": "none",
          "hit_group": 0,
          "juggle_cost": 1,
          "parryable": true
        }
      ],
      "events": [],
      "cancel_rules": [
        {
          "start": 3,
          "end": 8,
          "requires_contact": true,
          "targets": [
            "special",
            "selected_super",
            "ex_special"
          ]
        }
      ],
      "negative_edge": false,
      "availability": "base",
      "pose": "c_lp",
      "invulnerability": [],
      "movement": [],
      "projectile": null,
      "credit_cost": 0,
      "debit_on_start": false
    },
    {
      "id": "c_mp",
      "name": "C MP",
      "kind": "normal",
      "command": "C+MP",
      "startup": 5,
      "active": 3,
      "recovery": 12,
      "hitboxes": [
        {
          "id": "h0",
          "start": 5,
          "end": 8,
          "x": 8000,
          "y": 20000,
          "width": 43000,
          "height": 17000,
          "level": "mid",
          "damage": 65,
          "stun": 85,
          "rank": 2,
          "hitstun": 21,
          "blockstun": 13,